{"contract_version":"nhi.evidence_batch.v1","batch_id":"x_bullish","source_type":"x_twitter","verification_status":"user_verified","items":[{"item_id":"x1","source_type":"x_twitter","verification_status":"user_verified","direction":"bullish","timestamp":"2026-06-30T00:00:00Z","captured_at":"2026-07-01T00:00:00Z","author_handle":"source_a","likes":100,"reposts":20,"claim_tags":["product_signal"],"source_credibility":0.8,"thesis_relevance":0.9}]}
