{"contract_version":"nhi.evidence_batch.v1","batch_id":"reddit_unverified","source_type":"reddit","verification_status":"unverified_extraction","items":[{"item_id":"r8","source_type":"reddit","verification_status":"unverified_extraction","direction":"bearish","timestamp":"2026-06-30T00:00:00Z","captured_at":"2026-07-01T00:00:00Z","subreddit":"synthetic_eta","score":10,"claim_tags":["extracted_claim"],"source_credibility":0.5,"thesis_relevance":0.5,"echo_chamber_risk":0.5}]}
