{"contract_version":"nhi.evidence_batch.v1","batch_id":"reddit_bearish","source_type":"reddit","verification_status":"user_verified","items":[{"item_id":"r2","source_type":"reddit","verification_status":"user_verified","direction":"bearish","timestamp":"2026-06-30T00:00:00Z","captured_at":"2026-07-01T00:00:00Z","subreddit":"synthetic_beta","score":90,"claim_tags":["counterargument"],"source_credibility":0.8,"thesis_relevance":0.9,"echo_chamber_risk":0.2}]}
