{"contract_version":"nhi.evidence_batch.v1","batch_id":"x_bearish","source_type":"x_twitter","verification_status":"user_verified","items":[{"item_id":"x2","source_type":"x_twitter","verification_status":"user_verified","direction":"bearish","timestamp":"2026-06-30T00:00:00Z","captured_at":"2026-07-01T00:00:00Z","author_handle":"source_b","likes":80,"claim_tags":["regulatory_event"],"source_credibility":0.8,"thesis_relevance":0.9}]}
