{"contract_version":"nhi.evidence_batch.v1","batch_id":"x_unverified","source_type":"x_twitter","verification_status":"unverified_extraction","items":[{"item_id":"x7","source_type":"x_twitter","verification_status":"unverified_extraction","direction":"bullish","timestamp":"2026-06-30T00:00:00Z","captured_at":"2026-07-01T00:00:00Z","author_handle":"source_e","claim_tags":["extracted_claim"],"source_credibility":0.5,"thesis_relevance":0.5}]}
