{"contract_version":"nhi.evidence_batch.v1","batch_id":"x_noise","source_type":"x_twitter","verification_status":"user_verified","items":[{"item_id":"x5","source_type":"x_twitter","verification_status":"user_verified","direction":"bullish","timestamp":"2026-06-20T00:00:00Z","captured_at":"2026-07-01T00:00:00Z","author_handle":"source_c","likes":2,"claim_tags":["vague_claim"],"source_credibility":0.1,"thesis_relevance":0.3}]}
