{"contract_version":"nhi.evidence_batch.v1","batch_id":"reddit_echo","source_type":"reddit","verification_status":"user_verified","items":[{"item_id":"r3","source_type":"reddit","verification_status":"user_verified","direction":"bullish","timestamp":"2026-06-30T00:00:00Z","captured_at":"2026-07-01T00:00:00Z","subreddit":"synthetic_gamma","score":70,"claim_tags":["echo_claim"],"source_credibility":0.5,"thesis_relevance":0.7,"echo_chamber_risk":0.9}]}
