{"contract_version":"nhi.evidence_batch.v1","batch_id":"reddit_duplicates","source_type":"reddit","verification_status":"user_verified","items":[{"item_id":"r6","source_type":"reddit","verification_status":"user_verified","direction":"bullish","timestamp":"2026-06-30T00:00:00Z","captured_at":"2026-07-01T00:00:00Z","subreddit":"synthetic_zeta","score":30,"claim_tags":["same_claim"],"source_credibility":0.6,"thesis_relevance":0.7,"echo_chamber_risk":0.5},{"item_id":"r7","source_type":"reddit","verification_status":"user_verified","direction":"bullish","timestamp":"2026-06-30T00:00:00Z","captured_at":"2026-07-01T00:00:00Z","subreddit":"synthetic_zeta","score":25,"claim_tags":["same_claim"],"source_credibility":0.6,"thesis_relevance":0.7,"echo_chamber_risk":0.5}]}
