{"contract_version":"nhi.evidence_batch.v1","batch_id":"x_duplicates","source_type":"x_twitter","verification_status":"user_verified","items":[{"item_id":"x3","source_type":"x_twitter","verification_status":"user_verified","direction":"bullish","timestamp":"2026-06-30T00:00:00Z","captured_at":"2026-07-01T00:00:00Z","author_handle":"a","likes":40,"claim_tags":["same_claim"],"source_credibility":0.6,"thesis_relevance":0.8},{"item_id":"x4","source_type":"x_twitter","verification_status":"user_verified","direction":"bullish","timestamp":"2026-06-30T01:00:00Z","captured_at":"2026-07-01T00:00:00Z","author_handle":"b","likes":35,"claim_tags":["same_claim"],"source_credibility":0.6,"thesis_relevance":0.8}]}
