{"contract_version":"nhi.evidence_batch.v1","batch_id":"reddit_bullish","source_type":"reddit","verification_status":"user_verified","items":[{"item_id":"r1","source_type":"reddit","verification_status":"user_verified","direction":"bullish","timestamp":"2026-06-30T00:00:00Z","captured_at":"2026-07-01T00:00:00Z","subreddit":"synthetic_alpha","score":120,"claim_tags":["conviction"],"source_credibility":0.7,"thesis_relevance":0.8,"echo_chamber_risk":0.2}]}
