{"contract_version":"nhi.evidence_batch.v1","batch_id":"x_quality","source_type":"x_twitter","verification_status":"user_corrected","items":[{"item_id":"x6","source_type":"x_twitter","verification_status":"user_corrected","direction":"bullish","timestamp":"2026-06-30T00:00:00Z","captured_at":"2026-07-01T00:00:00Z","author_handle":"source_d","likes":200,"reposts":40,"claim_tags":["specific_product"],"source_credibility":0.95,"thesis_relevance":0.95}]}
